{
  "version": 1,
  "meta": {
    "title": "Grandchild"
  },
  "lenses": [
    {
      "id": "main",
      "label": "Main"
    }
  ],
  "stageOrder": [
    "start",
    "inside"
  ],
  "nodes": [
    {
      "id": "e",
      "kind": "box",
      "at": [
        0,
        100
      ],
      "size": [
        200,
        100
      ],
      "title": "E"
    }
  ],
  "edges": [],
  "scenes": {
    "main": [
      {
        "key": "start",
        "label": "Start",
        "title": "Grandchild",
        "caption": "Grandchild.",
        "camera": [
          0,
          0,
          800,
          400
        ],
        "active": {
          "nodes": [
            "e"
          ]
        }
      }
    ]
  }
}
