{
  "version": 1,
  "meta": {
    "title": "Loop B"
  },
  "lenses": [
    {
      "id": "main",
      "label": "Main"
    }
  ],
  "stageOrder": [
    "start",
    "inside"
  ],
  "nodes": [
    {
      "id": "y",
      "kind": "box",
      "at": [
        0,
        100
      ],
      "size": [
        200,
        100
      ],
      "title": "Y",
      "zoom": {
        "journey": "./loop-a.json"
      }
    }
  ],
  "edges": [],
  "scenes": {
    "main": [
      {
        "key": "start",
        "label": "Start",
        "title": "Loop B",
        "caption": "Loop B.",
        "camera": [
          0,
          0,
          800,
          400
        ],
        "active": {
          "nodes": [
            "y"
          ]
        }
      }
    ]
  }
}
